{"agent_name":"heuristic","contract_versions":{"action":"dxai.action.v1","observation":"dxai.observation.v1","transition":"dxai.transition.v1"},"created_at_utc":"2026-08-11T22:34:57.024279+00:00","data_source":"SCRIPTED","engine":{"name":"dxai.mock","revision":"v1"},"episode_id":"mock-combat.single_melee.v0-7-0000","outcome":"SUCCESS","schema_version":"dxai.episode_manifest.v1","seed":7,"step_count":14,"task_id":"combat.single_melee.v0","terminated":true,"total_reward":1.181,"trajectory_file":"transitions.jsonl","trajectory_sha256":"729fc3c6913fb7c9107a36ef28ba6ca06e2c62468e0c686dba6c94981da81f59","truncated":false}
